{"canonicalChecksum":"39d50799b14f19f1abfb2a3ca438025c67c89d8649893c66c8655fc78858a617","contractVersion":"foundation-river-graph-roles-validation-artifact-v1","issues":[],"metrics":{"childOwnershipOk":true,"cycleFree":true,"elevationContinuityOk":true,"flowConservationOk":true,"graphBudgetOk":true,"modifierOrderOk":true,"sourceMouthReachable":true,"waterfallChainOk":true,"wholeTileOk":true},"planVersion":1,"riverFeatureId":"role-river","waterfallChainId":"cascade-chain"}